{
  "$schema": "https://json-schema.org/draft/2020-12/schema",
  "$id": "https://mascotrender.dev/schema/pack-v1.json",
  "title": "MascotRender pack",
  "type": "object",
  "additionalProperties": false,
  "required": [
    "schema_version",
    "pack_id",
    "canvas",
    "layers",
    "base_layers",
    "expressions",
    "poses",
    "provenance",
    "anchors",
    "pivots"
  ],
  "$defs": {
    "layerIds": {
      "type": "array",
      "uniqueItems": true,
      "items": { "type": "string", "minLength": 1 }
    },
    "point": {
      "type": "object",
      "additionalProperties": false,
      "required": ["x", "y"],
      "properties": {
        "x": { "type": "number" },
        "y": { "type": "number" }
      }
    },
    "layerTransform": {
      "type": "object",
      "additionalProperties": false,
      "properties": {
        "x": { "type": "number", "minimum": -4096, "maximum": 4096 },
        "y": { "type": "number", "minimum": -4096, "maximum": 4096 },
        "rotation_degrees": { "type": "number", "minimum": -3600, "maximum": 3600 },
        "scale_x": { "type": "number", "exclusiveMinimum": 0, "maximum": 100 },
        "scale_y": { "type": "number", "exclusiveMinimum": 0, "maximum": 100 },
        "opacity": { "type": "number", "minimum": 0, "maximum": 1 }
      }
    },
    "rect": {
      "type": "object",
      "additionalProperties": false,
      "required": ["x", "y", "width", "height"],
      "properties": {
        "x": { "type": "number", "minimum": 0 },
        "y": { "type": "number", "minimum": 0 },
        "width": { "type": "number", "exclusiveMinimum": 0 },
        "height": { "type": "number", "exclusiveMinimum": 0 }
      }
    },
    "avoidRegion": {
      "type": "object",
      "additionalProperties": false,
      "required": ["name", "x", "y", "width", "height"],
      "properties": {
        "name": { "type": "string", "minLength": 1 },
        "x": { "type": "number", "minimum": 0 },
        "y": { "type": "number", "minimum": 0 },
        "width": { "type": "number", "exclusiveMinimum": 0 },
        "height": { "type": "number", "exclusiveMinimum": 0 }
      }
    },
    "rgb": {
      "type": "object",
      "additionalProperties": false,
      "required": ["r", "g", "b"],
      "properties": {
        "r": { "type": "integer", "minimum": 0, "maximum": 255 },
        "g": { "type": "integer", "minimum": 0, "maximum": 255 },
        "b": { "type": "integer", "minimum": 0, "maximum": 255 }
      }
    }
  },
  "properties": {
    "schema_version": { "const": 1 },
    "pack_id": { "type": "string", "minLength": 1 },
    "character_identity": {
      "type": "object",
      "additionalProperties": false,
      "required": ["character_id", "contract_version", "contract_sha256", "required_features"],
      "properties": {
        "character_id": { "type": "string", "minLength": 1 },
        "contract_version": { "type": "integer", "minimum": 1 },
        "contract_sha256": { "type": "string", "pattern": "^[0-9a-f]{64}$" },
        "required_features": {
          "type": "array",
          "minItems": 1,
          "uniqueItems": true,
          "items": { "type": "string", "minLength": 1 }
        }
      }
    },
    "rig": {
      "type": "object",
      "additionalProperties": false,
      "required": ["contract_id", "contract_version", "pose_bindings"],
      "properties": {
        "contract_id": { "type": "string", "minLength": 1 },
        "contract_version": { "type": "integer", "minimum": 1 },
        "device_profile": { "type": "string", "minLength": 1 },
        "device_bindings": {
          "type": "object",
          "additionalProperties": { "type": "string", "minLength": 1 }
        },
        "pose_bindings": {
          "type": "object",
          "minProperties": 1,
          "additionalProperties": {
            "type": "object",
            "minProperties": 1,
            "additionalProperties": { "type": "string", "minLength": 1 }
          }
        }
      }
    },
    "canvas": {
      "type": "object",
      "additionalProperties": false,
      "required": ["width", "height"],
      "properties": {
        "width": { "type": "integer", "minimum": 1, "maximum": 4096 },
        "height": { "type": "integer", "minimum": 1, "maximum": 4096 }
      }
    },
    "layers": {
      "type": "array",
      "minItems": 1,
      "items": {
        "type": "object",
        "additionalProperties": false,
        "required": ["id", "source", "z"],
        "properties": {
          "id": { "type": "string", "minLength": 1 },
          "source": { "type": "string", "pattern": "^[^:/\\\\]+(?:/[^:/\\\\]+)*\\.svg$" },
          "lod_sources": {
            "type": "object",
            "minProperties": 1,
            "propertyNames": { "pattern": "^(?:[3-9][0-9]|[1-4][0-9]{2}|5(?:0[0-9]|1[0-2]))$" },
            "additionalProperties": { "type": "string", "pattern": "^[^:/\\\\]+(?:/[^:/\\\\]+)*\\.svg$" }
          },
          "z": { "type": "integer" },
          "collision_bounds": { "$ref": "#/$defs/rect" },
          "parent": { "type": "string", "minLength": 1 },
          "pivot": { "type": "string", "minLength": 1 },
          "depth": { "type": "number", "minimum": -4, "maximum": 4 },
          "screen_space": { "type": "boolean" },
          "transform": { "$ref": "#/$defs/layerTransform" }
        }
      }
    },
    "base_layers": { "$ref": "#/$defs/layerIds" },
    "expressions": {
      "type": "object",
      "minProperties": 1,
      "additionalProperties": { "$ref": "#/$defs/layerIds" }
    },
    "poses": {
      "type": "object",
      "minProperties": 1,
      "additionalProperties": { "$ref": "#/$defs/layerIds" }
    },
    "provenance": {
      "type": "object",
      "additionalProperties": false,
      "required": ["creator", "license", "source"],
      "properties": {
        "creator": { "type": "string", "minLength": 1 },
        "license": { "type": "string", "minLength": 1 },
        "source": { "type": "string", "minLength": 1 }
      }
    },
    "anchors": {
      "type": "object",
      "additionalProperties": { "$ref": "#/$defs/point" }
    },
    "pivots": {
      "type": "object",
      "additionalProperties": { "$ref": "#/$defs/point" }
    },
    "text_slots": {
      "type": "object",
      "minProperties": 1,
      "additionalProperties": { "$ref": "#/$defs/rect" }
    },
    "avoid_regions": {
      "type": "array",
      "uniqueItems": true,
      "items": { "$ref": "#/$defs/avoidRegion" }
    },
    "text_clearance": {
      "type": "number",
      "minimum": 0,
      "maximum": 128
    },
    "caption_validation": {
      "type": "object",
      "additionalProperties": false,
      "required": [
        "minimum_canvas_margin_px",
        "maximum_lines",
        "must_remain_inside_canvas_for_every_frame",
        "may_overlap_character",
        "may_overlap_assistive_device",
        "must_pass_sizes_px"
      ],
      "properties": {
        "minimum_canvas_margin_px": { "type": "integer", "minimum": 0, "maximum": 128 },
        "maximum_lines": { "type": "integer", "minimum": 1, "maximum": 4 },
        "must_remain_inside_canvas_for_every_frame": { "type": "boolean" },
        "may_overlap_character": { "type": "boolean" },
        "may_overlap_assistive_device": { "type": "boolean" },
        "must_pass_sizes_px": {
          "type": "array",
          "minItems": 1,
          "uniqueItems": true,
          "items": { "type": "integer", "minimum": 16, "maximum": 4096 }
        },
        "collision_bounds": { "type": "string", "minLength": 1 }
      }
    },
    "fonts": {
      "type": "array",
      "minItems": 1,
      "items": {
        "type": "object",
        "additionalProperties": false,
        "required": ["id", "source", "license"],
        "properties": {
          "id": { "type": "string", "minLength": 1 },
          "source": { "type": "string", "pattern": "^[^:/\\\\]+(?:/[^:/\\\\]+)*\\.ttf$" },
          "license": { "type": "string", "pattern": "^[^:/\\\\]+(?:/[^:/\\\\]+)*\\.txt$" }
        }
      }
    },
    "text_styles": {
      "type": "object",
      "minProperties": 1,
      "additionalProperties": {
        "type": "object",
        "additionalProperties": false,
        "required": [
          "font",
          "safe_area",
          "min_font_size",
          "max_font_size",
          "max_lines",
          "fill"
        ],
        "properties": {
          "font": { "type": "string", "minLength": 1 },
          "safe_area": { "$ref": "#/$defs/rect" },
          "min_font_size": { "type": "number", "exclusiveMinimum": 0, "maximum": 512 },
          "max_font_size": { "type": "number", "exclusiveMinimum": 0, "maximum": 512 },
          "max_lines": { "type": "integer", "minimum": 1, "maximum": 3 },
          "fill": { "$ref": "#/$defs/rgb" },
          "outline": {
            "type": "object",
            "additionalProperties": false,
            "required": ["width", "color"],
            "properties": {
              "width": { "type": "number", "minimum": 0, "maximum": 32 },
              "color": { "$ref": "#/$defs/rgb" }
            }
          },
          "depth_shell": {
            "type": "object",
            "additionalProperties": false,
            "required": ["offset_x", "offset_y", "color"],
            "properties": {
              "offset_x": { "type": "number", "minimum": -64, "maximum": 64 },
              "offset_y": { "type": "number", "minimum": -64, "maximum": 64 },
              "color": { "$ref": "#/$defs/rgb" }
            }
          },
          "highlight_shell": {
            "type": "object",
            "additionalProperties": false,
            "required": ["offset_x", "offset_y", "color"],
            "properties": {
              "offset_x": { "type": "number", "minimum": -64, "maximum": 64 },
              "offset_y": { "type": "number", "minimum": -64, "maximum": 64 },
              "color": { "$ref": "#/$defs/rgb" }
            }
          }
        }
      }
    },
    "variation_groups": {
      "type": "array",
      "items": {
        "type": "object",
        "additionalProperties": false,
        "required": ["id", "choices"],
        "properties": {
          "id": { "type": "string", "minLength": 1 },
          "choices": {
            "type": "array",
            "minItems": 1,
            "items": { "$ref": "#/$defs/layerIds" }
          }
        }
      }
    }
  }
}
